{
  "id": "estandartes:doctrine/escocesa",
  "name": "Doctrina escocesa",
  "weights": {
    "estandartes:unit/lanceros_escoceses": 0.75,
    "estandartes:unit/arqueros": 0.05,
    "estandartes:unit/caballeria_ligera": 0.05,
    "estandartes:unit/hostigadores": 0.15
  },
  "preferredPlans": {
    "wait_and_strike": 0.5,
    "defend_high_ground": 0.2
  },
  "deployment": {
    "ShockInfantry": "Center",
    "PolearmInfantry": "Center",
    "Ranged": "Front",
    "Skirmisher": "Front",
    "ShockCavalry": "Wings",
    "LightCavalry": "Wings",
    "Engineer": "Reserve",
    "Command": "Escort"
  }
}
