{
  "id": "estandartes:doctrine/inglesa_1297",
  "name": "Doctrina inglesa (finales del s. XIII)",
  "weights": {
    "estandartes:unit/caballeria_pesada": 0.2,
    "estandartes:unit/hombres_de_armas": 0.25,
    "estandartes:unit/arqueros": 0.2,
    "estandartes:unit/lanceros": 0.2,
    "estandartes:unit/levas": 0.15
  },
  "preferredPlans": {
    "frontal": 0.3
  },
  "deployment": {
    "ShockInfantry": "Center",
    "PolearmInfantry": "Center",
    "Ranged": "Front",
    "Skirmisher": "Front",
    "ShockCavalry": "Wings",
    "LightCavalry": "Wings",
    "Engineer": "Reserve",
    "Command": "Escort"
  }
}
