{
  "id": "estandartes:doctrine/normanda",
  "name": "Doctrina normanda",
  "weights": {
    "estandartes:unit/hombres_de_armas": 0.35,
    "estandartes:unit/arqueros": 0.2,
    "estandartes:unit/ballesteros": 0.05,
    "estandartes:unit/caballeros_normandos": 0.3,
    "estandartes:unit/levas": 0.1
  },
  "preferredPlans": {
    "feigned_retreat": 0.3,
    "anvil_hammer": 0.2
  },
  "deployment": {
    "ShockInfantry": "Center",
    "PolearmInfantry": "Center",
    "Ranged": "Front",
    "Skirmisher": "Front",
    "ShockCavalry": "Wings",
    "LightCavalry": "Wings",
    "Engineer": "Reserve",
    "Command": "Escort"
  }
}
