{
  "id": "estandartes:doctrine/francesa_1204",
  "name": "Doctrina francesa (c. 1200)",
  "weights": {
    "estandartes:unit/hombres_de_armas": 0.3,
    "estandartes:unit/ballesteros": 0.2,
    "estandartes:unit/levas": 0.2,
    "estandartes:unit/zapadores": 0.1,
    "estandartes:unit/caballeria_pesada": 0.15,
    "estandartes:unit/paveseros": 0.05
  },
  "preferredPlans": {
    "staged_assault": 0.3
  },
  "deployment": {
    "ShockInfantry": "Center",
    "PolearmInfantry": "Center",
    "Ranged": "Front",
    "Skirmisher": "Front",
    "ShockCavalry": "Wings",
    "LightCavalry": "Wings",
    "Engineer": "Reserve",
    "Command": "Escort"
  }
}
