{
  "id": "estandartes:doctrine/anglosajona",
  "name": "Doctrina anglosajona",
  "weights": {
    "estandartes:unit/huscarles": 0.3,
    "estandartes:unit/fyrd": 0.6,
    "estandartes:unit/arqueros": 0.05,
    "estandartes:unit/hostigadores": 0.05
  },
  "preferredPlans": {
    "defend_high_ground": 0.4,
    "wait": 0.2
  },
  "deployment": {
    "ShockInfantry": "Center",
    "PolearmInfantry": "Center",
    "Ranged": "Front",
    "Skirmisher": "Front",
    "ShockCavalry": "Wings",
    "LightCavalry": "Wings",
    "Engineer": "Reserve",
    "Command": "Escort"
  }
}
